{
  "$schema": "../schemas/product-portfolio.v1.schema.json",
  "schema": "kingdom.product-portfolio/v1",
  "as_of": "2026-09-01",
  "boundary": "This is a product and business architecture, not deployed moderation, consent, treasury, governance, quantum advantage, legal compliance, or publication authority. Existing prototype evidence is named per product; all other capability remains declared only.",
  "power_architecture_ref": {
    "snapshot_schema": "kingdom.power-module-snapshot/v1",
    "registry_schema": "kingdom.power-module-registry/v0.2",
    "source": "registry/power-modules.snapshot.json",
    "source_sha256": "2540b751fc921ee8f86c942547ee4fb66e8876a9a265ff1c901ab81827452a57",
    "snapshot_date": "2026-08-30",
    "status": "proposed-unwired-reference"
  },
  "constitutional_invariants": {
    "standing_rights_votable": false,
    "binding_acts_in_heightened_context": false,
    "global_person_score": false,
    "tradable_evidence_or_governance_token": false,
    "payment_buys_consent_or_authority": false,
    "evidence_grade_changes_person_authority": false,
    "moderation_changes_scientific_grade": false,
    "consent_public_or_immutable_by_default": false
  },
  "implementation_truth": {
    "portfolio_validation_proves_runtime_enforcement": false,
    "social_financial_or_governance_effects_wired": false,
    "power_counterweights_wired": false
  },
  "principles": [
    "Persuasion is evaluated by disclosure, context, choice, dependency, reversibility, and aftermath rather than by whether the speaker believes the goal is good.",
    "Consent authorizes one specific binding act; it is not inferred from attention, participation, payment, role, silence, identity, prior consent, or a signature alone.",
    "Reward useful work regardless of whether a hypothesis succeeds; never pay for a desired scientific conclusion.",
    "Evidence grade belongs to a scoped claim, never to the global worth or authority of its author.",
    "Money, status, expertise, technical access, reputation, and community belonging never convert automatically into governance or enforcement authority.",
    "Moderation restricts the smallest necessary action or capability and preserves notice, expiry, appeal, privacy, refusal, and repair.",
    "Binding acts occur through neutral interfaces outside heightened-attention, ritualized, urgent, or dependency-leveraging contexts.",
    "Every outward product has a separately controlled counterweight able to hold release, plus an honest exit and repair route."
  ],
  "conversion_firewalls_sha256": "cf365ef14cec753288a42555fd8111641cf42c903cfcdb76953070614f6482d1",
  "conversion_firewalls": [
    {
      "id": "CF-01",
      "source": "attention",
      "target": "choice",
      "risk": "Cadence, repetition, ranking, prestige, or urgency narrows attention before alternatives are considered.",
      "gate": "Disclose source, sponsor, intended action, material techniques, uncertainty, and a functionally equal quiet or plain route before exposure.",
      "automatic": false
    },
    {
      "id": "CF-02",
      "source": "choice",
      "target": "consent",
      "risk": "A click or continued presence is treated as informed and freely given authorization.",
      "gate": "State the exact act, data, recipient, duration, consequences, alternatives, withdrawal route, and comprehension check with a neutral no-action option.",
      "automatic": false
    },
    {
      "id": "CF-03",
      "source": "consent",
      "target": "binding act",
      "risk": "Old, broad, coerced, or context-specific consent is replayed after purpose, party, risk, or capability changes.",
      "gate": "Revalidate current scope, authority, affected parties, expiry, withdrawal state, dependency health, and material transition before execution.",
      "automatic": false
    },
    {
      "id": "CF-04",
      "source": "interest or consent",
      "target": "payment",
      "risk": "Parasocial obligation, scarcity, arousal, fear, sunk cost, or repeated prompts turn interest into financially pressured action.",
      "gate": "Use a neutral checkout, full cost and renewal preview, spending cap, cooling-off where consequential, persistent refusal, simple cancellation, and no unrelated penalty.",
      "automatic": false
    },
    {
      "id": "CF-05",
      "source": "evidence",
      "target": "claim language",
      "risk": "A simulation, weak baseline, vivid anecdote, or sponsor-preferred result is promoted beyond what it establishes.",
      "gate": "Require preregistration, strong baseline review, permitted-language templates, conflicts, evidence grade, expiry, correction links, and independent reproduction at the relevant level.",
      "automatic": false
    },
    {
      "id": "CF-06",
      "source": "claim language",
      "target": "attention",
      "risk": "Ranking systems reward certainty and spectacle while null results, uncertainty, and correction disappear.",
      "gate": "Provide chronological or unranked views, equal correction visibility, negative-result lanes, sponsor labels, and no engagement-only ranking.",
      "automatic": false
    },
    {
      "id": "CF-07",
      "source": "claim or receipt",
      "target": "reward",
      "risk": "First-mover rewards induce racing, selective reporting, weak baselines, fabricated novelty, and resistance to correction.",
      "gate": "Prepay defined labour independent of outcome, reserve reproduction funding under separate control, compensate null and corrective work, prohibit payment for a desired result or evidence grade, and allocate future resources through separate task criteria.",
      "automatic": false
    },
    {
      "id": "CF-08",
      "source": "reward or contribution",
      "target": "reputation",
      "risk": "Money, volume, popularity, or one domain result becomes a scalar judgment of a person and makes dissent costly.",
      "gate": "Use contextual, evidence-linked, expiring contribution records with correction and appeal; prohibit global person scores and inactivity penalties.",
      "automatic": false
    },
    {
      "id": "CF-09",
      "source": "reputation, expertise, wealth, or access",
      "target": "governance or scarce-resource priority",
      "risk": "Incumbents become self-certifying and wealth or vendor access becomes jurisdiction.",
      "gate": "Constitute governance separately; use scoped role mandates, transparent allocation criteria, conflicts, rotation, starvation metrics, expiry, and independent appeal.",
      "automatic": false
    },
    {
      "id": "CF-10",
      "source": "moderation report or enforcement decision",
      "target": "exclusion, financial loss, or scientific grade",
      "risk": "Brigades, opaque moderators, or status-weighted reports punish dissent or remove livelihood without due process.",
      "gate": "Separate conduct from evidence review, detect correlated reporting, apply the least restrictive expiring action, disclose conflicts, and provide notice, independent appeal, and repair.",
      "automatic": false
    },
    {
      "id": "CF-11",
      "source": "participation or submission",
      "target": "licence, reuse, endorsement, or ownership",
      "risk": "Contest entry, community membership, or attribution is interpreted as perpetual broad permission or creator endorsement.",
      "gate": "Separate eligibility from licence; name each use, duration, territory, attribution, compensation, downstream recipient, withdrawal point, and non-winning treatment before contribution.",
      "automatic": false
    },
    {
      "id": "CF-12",
      "source": "evidence, consent, or moderation record",
      "target": "immutable ledger or public permanence",
      "risk": "Hashes or signatures are mistaken for truth or anonymity while errors and sensitive relationships become permanent.",
      "gate": "Keep raw and personal state private and off-chain; project only minimized candidate status after review, with zero automatic reward, authority, identity, or retention effect.",
      "automatic": false
    }
  ],
  "products": [
    {
      "id": "KP-INFLUENCE-LENS",
      "name": "KINGDOM Influence Lens",
      "family": "constitutional",
      "design_stage": "contract",
      "implementation": {
        "state": "declared-only",
        "evidence_refs": [],
        "known_gaps": ["No influence-card renderer, linter, interface, or conformance fixture is implemented."],
        "live_effects": false
      },
      "primary_users": [
        "people evaluating an offer, campaign, community invitation, or public claim",
        "product, communications, safety, and governance teams"
      ],
      "job_to_be_done": "Make persuasive power legible before a person is asked to choose, pay, join, disclose, vote, or grant access.",
      "does": "Specifies a plain influence card covering source, sponsor, desired action, techniques, evidence, uncertainty, targeting basis, intensity, dependency, alternatives, cooldown, and exit.",
      "does_not": "It does not diagnose manipulation, infer psychological vulnerability, score a person, block ordinary expression, or make the decision for the participant.",
      "workflow": [
        "Declare source, beneficiary, sponsor, desired action, audience, channel, duration, and material techniques.",
        "Attach neutral claims, sources, counterevidence, uncertainty, total cost, and the plain route.",
        "Run the Power Table and separate any binding act from persuasive presentation.",
        "Show quiet, chronological, reset, pause, refusal, and complaint controls.",
        "Record only the disclosure version and product decision, not a vulnerability profile."
      ],
      "business_model": {
        "description": "Free local schema and reader; fixed-price organizational review or hosted disclosure management.",
        "revenue_events": ["free-open-core", "fixed-fee", "fixed-subscription"],